{
  "published_at": "2026-10-14T23:54:12Z",
  "as_of": "2026-10-14",
  "official_month": "2026-09-01",
  "rows": [
    {
      "component": "shelter_owned",
      "label": "Shelter (owned)",
      "weight": 0.262168,
      "mode": "live",
      "ours_yoy_pct": 1.52,
      "bls_yoy_pct": 3.28,
      "gap_pp": -1.76,
      "contribution_pp": -0.46
    },
    {
      "component": "fuel",
      "label": "Gasoline",
      "weight": 0.029754,
      "mode": "live",
      "ours_yoy_pct": 39.76,
      "bls_yoy_pct": 34.17,
      "gap_pp": 5.59,
      "contribution_pp": 0.17
    },
    {
      "component": "shelter_rent",
      "label": "Rent",
      "weight": 0.074579,
      "mode": "live",
      "ours_yoy_pct": 1.52,
      "bls_yoy_pct": 2.78,
      "gap_pp": -1.26,
      "contribution_pp": -0.09
    },
    {
      "component": "used_vehicles",
      "label": "Used cars & trucks",
      "weight": 0.02411,
      "mode": "live",
      "ours_yoy_pct": -1.79,
      "bls_yoy_pct": -1.46,
      "gap_pp": -0.33,
      "contribution_pp": -0.01
    },
    {
      "component": "other",
      "label": "Everything else (CPI residual)",
      "weight": 0.180519,
      "mode": "bls_cf",
      "ours_yoy_pct": 3.45,
      "bls_yoy_pct": 3.45,
      "gap_pp": 0.0,
      "contribution_pp": 0.0
    },
    {
      "component": "food_home",
      "label": "Food at home",
      "weight": 0.080095,
      "mode": "bls_cf",
      "ours_yoy_pct": 1.81,
      "bls_yoy_pct": 1.81,
      "gap_pp": 0.0,
      "contribution_pp": 0.0
    },
    {
      "component": "medical",
      "label": "Medical care",
      "weight": 0.082601,
      "mode": "bls_cf",
      "ours_yoy_pct": 1.5,
      "bls_yoy_pct": 1.5,
      "gap_pp": 0.0,
      "contribution_pp": 0.0
    },
    {
      "component": "food_away",
      "label": "Food away from home",
      "weight": 0.056464,
      "mode": "bls_cf",
      "ours_yoy_pct": 3.46,
      "bls_yoy_pct": 3.46,
      "gap_pp": 0.0,
      "contribution_pp": 0.0
    },
    {
      "component": "education_comm",
      "label": "Education & comm",
      "weight": 0.056387,
      "mode": "bls_cf",
      "ours_yoy_pct": 2.31,
      "bls_yoy_pct": 2.31,
      "gap_pp": 0.0,
      "contribution_pp": 0.0
    },
    {
      "component": "recreation",
      "label": "Recreation",
      "weight": 0.052717,
      "mode": "bls_cf",
      "ours_yoy_pct": 2.84,
      "bls_yoy_pct": 2.84,
      "gap_pp": -0.0,
      "contribution_pp": -0.0
    },
    {
      "component": "new_vehicles",
      "label": "New vehicles",
      "weight": 0.042979,
      "mode": "bls_cf",
      "ours_yoy_pct": 0.61,
      "bls_yoy_pct": 0.61,
      "gap_pp": 0.0,
      "contribution_pp": 0.0
    },
    {
      "component": "electricity",
      "label": "Electricity",
      "weight": 0.024428,
      "mode": "bls_cf",
      "ours_yoy_pct": 4.37,
      "bls_yoy_pct": 4.37,
      "gap_pp": 0.0,
      "contribution_pp": 0.0
    },
    {
      "component": "apparel",
      "label": "Apparel",
      "weight": 0.025625,
      "mode": "bls_cf",
      "ours_yoy_pct": 3.41,
      "bls_yoy_pct": 3.41,
      "gap_pp": -0.0,
      "contribution_pp": -0.0
    },
    {
      "component": "nat_gas",
      "label": "Piped gas",
      "weight": 0.007574,
      "mode": "bls_cf",
      "ours_yoy_pct": 4.97,
      "bls_yoy_pct": 4.97,
      "gap_pp": 0.0,
      "contribution_pp": 0.0
    }
  ],
  "total_gap_pp": -0.4,
  "variants": {
    "gauge": {
      "yoy_pct": 3.28,
      "as_of": "2026-10-14",
      "coverage_pct": 39.06
    },
    "col": {
      "yoy_pct": 5.9,
      "as_of": "2026-10-14",
      "coverage_pct": 39.06
    },
    "tracker": {
      "yoy_pct": 3.84,
      "as_of": "2026-10-14",
      "coverage_pct": 2.98
    },
    "supercore": {
      "yoy_pct": 2.9,
      "as_of": "2026-09-01",
      "coverage_pct": 0.0
    },
    "pce": {
      "yoy_pct": 3.28,
      "as_of": "2026-10-14",
      "coverage_pct": 18.9
    }
  }
}
